914,Rhodes Hall,,,,,"Society/Association, Other",,,"1516 Peachtree St., NW, Atlanta, GA 30309",,,,,,Fulton County,,,Georgia,,,United States of America,,,,,,+1-,,,,,,http://www.georgiatrust.org/historic_sites/rhodes_hall.htm,,,,,,"","","",,,,,,,,,,,,,,,,"",""
915,Robert Toombs House State Historic Site,,,,,"Historic Site (Parks, etc.)",,,"216 E. Robert Toombs Avenue, Washington, GA 30673",,,,,,Wilkes County,,,Georgia,,,United States of America,,,,,,+1-,,,mailto:Robert_Toombs@dnr.state.ga.us,,,http://gastateparks.org/info/rtoombs/,,,1982,,,"","","",,,,,,,605,,,,,,,,,"",""
916,Rockdale County Genealogical Society,,,,,Genealogical Society,,,"864 Green Street, Conyers, GA 30012",,,,,,Rockdale County,,,Georgia,,,United States of America,,,,,,+1-,,,mailto:zawadzki@bellsouth.net,,,http://mtf.home.mindspring.com,,,1993,,,"","","",,,,,,,,,,,,,,,,"",""
917,Rockdale County Historical Society,,,,,Historical Society,,,"967 Milstead Avenue, Conyers, GA 30012",,,,,,Rockdale County,,,Georgia,,,United States of America,,,,,,+1-,,,,,,,,,1973,,,"","","",,,,,,,351,,,,,,,,,"",""
918,Rome Area Heritage Foundation,,,,,Historical Society,,,", Rome, GA 30162",,,,,,Floyd County,,,Georgia,,,United States of America,,,,,,+1-,,,,,,,,,1973,,,"","","",,,,,,,6181,,,,,,,,,"",""
919,Rome-Floyd County Library Special Collections Department,,,,,,,,"205 Riverside Parkway, Rome, GA 30161",,,,,,Floyd County,,,Georgia,,,United States of America,,,,,,+1-,,,,,,http://www.romelibrary.org,,,1911,,,"","","",,,,,,,,,,,,,,,,"",""
920,Roopville Archive and Historical Society,,,,,Historical Society,,,"165 Old Highway 27S, Roopville, GA 30170",,,,,,Carroll County,,,Georgia,,,United States of America,,,,,,+1-,,,,,,http://freepages.history.rootsweb.com,,,1984,,,"","","",,,,,,,285,,,,,,,,,"",""
921,Roosevelt's Little White House,,,,,Museum,,,"401 Little White House Rd., Warm Springs, GA 31830",,,,,,Meriwether County,,,Georgia,,,United States of America,,,,,,+1-,,,,,,http://www.fdr-littlewhitehouse.org,,,1947,,,"","","",,,,,,,,,,,,,,,,"",""
922,Roswell Historical Society,,,,,,,,"950 Forrest Street, Roswell, GA 30077",,,,,,Fulton County,,,Georgia,,,United States of America,,,,,,+1-,,,mailto:societyrhs@gmail.com,,,http://www.roswellhistoricalsociety.org,,,1971,,,"","","",,,,,,,1636,,,,,,RoswellHistoricalSociety/,,,"",""
923,Roundhouse Railroad Museum,,,,,Museum,,,"601 W. Harris Street, Savannah, GA 31401",,,,,,Chatham County,,,Georgia,,,United States of America,,,,,,+1-,,,mailto:nfleming@chsgeorgia.org,,,www.chsgoergia.org,,,,,,"","","",,,,,,,,,,,,,,,,"",""
924,Sandersville Technical College,,,,,,,,"1189 Deepstep Road, Sandersville, GA 31082",,,,,,Washington County,,,Georgia,,,United States of America,,,,,,+1-,,,,,,http://www.sandersvilletech.edu/library/library.htm,,,,,,"","","",,,,,,,,,,,,,,,,"",""
925,Sandy Springs Arts and Heritage Society,,,,,Historical Society,,,"254 Johnson Ferry Road, NW, Sandy Springs, GA 30328",,,,,,Fulton County,,,Georgia,,,United States of America,,,,,,+1-,,,,,,,,,1980,,,"","","",,,,,,,,,,,,,,,,"",""
926,Savannah Area Genealogical Association,,,,,Genealogical Society,,,", Savannah, GA 31416",,,,,,Chatham County,,,Georgia,,,United States of America,,,,,,+1-,,,mailto:wfh31307@hotmail.com,,,http://www.savannahgenealogy.org,,,1983,,,"","","",,,,,,,15385,,,,,,,,,"",""
927,Savannah College of Art and Design,,,"Art School in Savannah, Georgia, USA",,Art School,,,", Savannah, GA 31402",,,,,,Chatham County,,,Georgia,,,United States of America,,,,,,+1-,,,mailto:roallen@scad.edu,,,http://www.scad.edu,,,1978,,,"","","",,,,,,,3146,,,,,,,,,"",""
928,Savannah Jewish Archives,,,,,Society/Association,,,"501 Whitaker Street, Savannah, GA 31401",,,,,,Chatham County,,,Georgia,,,United States of America,,,,,,+1-,,,mailto:lstoudt@georgiahistory.com,,,http://www.georgiahistory.com,,,1995,,,"","","",,,,,,,,,,,,,,,,"",""
929,Savannah River Valley Genealogical Society,,,,,Genealogical Society,,,", Hartwell, GA 30643",,,,,,Hart County,,,Georgia,,,United States of America,,,,,,+1-,,,,,,https://srvgs.wordpress.com/,,,1987,,,"","","",,,,,,,895,,,,,,,,,"",""
930,Asa H. Gordon Library and Archives,,,,,,,,"2200 Tompkins Rd Box 20394, Savannah, GA 31404",,,,,,Chatham County,,,Georgia,,,United States of America,,,,,,+1-,,,mailto:specialcollections@savannahstate.edu,,,http://library.savannahstate.edu/quick_links/use_the_archives.php,,,,,,"","","",,,,,,,,,,,,,,,,"",""
931,Savannah-Ogeechee Canal Society,,,,,Museum,,,"681 Fort Argyle Road, Savannah, GA 31419",,,,,,Chatham County,,,Georgia,,,United States of America,,,,,,+1-,,,mailto:info@savannahogeecheecanal.com,,,http://www.savannahogeecheecanal.com/site/,,,,,,"","","",,,,,,,,,,,,,,,,"",""
932,Schley County Historical Society,,,,,Historical Society,,,", Ellaville, GA 31806",,,,,,Schley County,,,Georgia,,,United States of America,,,,,,+1-,,,,,,,,,1979,,,"","","",,,,,,,326,,,,,,,,,"",""
933,Seminole County Historical Society,,,,,Historical Society,,,", Donalsonville, GA 31759",,,,,,Seminole County,,,Georgia,,,United States of America,,,,,,+1-,,,,,,,,,1985,,,"","","",,,,,,,713,,,,,,,,,"",""
934,Sequoyah Regional Library,,,,,,,,"116 Brown Industrial Parkway, Canton, GA 30114",,,,,,Cherokee County,,,Georgia,,,United States of America,,,,,,+1-,,,,,,http://www.sequoyahregionallibrary.org/,,,,,,"","","",,,,,,,,,,,,,,,,"",""
935,Seven Springs Park,,,,,Historical Society,,,"3901 Brownsville Road, Powder Springs, GA 30127",,,,,,Cobb County,,,Georgia,,,United States of America,,,,,,+1-,,,,,,http://www.cityofpowdersprings.org,,,1985,,,"","","",,,,,,,4,,,,,,,,,"",""
936,Signal Corps History Office,,,,,,,,"431 B Street, Bldg. 29717, Fort Gordon, GA 30905",,,,,,Richmond County,,,Georgia,,,United States of America,,,,,,+1-,,,mailto:steven.rauch@us.army.mil,,,http://www.gordon.army.mil/ocos/museum/,,,1984,,,"","","",,,,,,,,,,,,,,,,"",""
937,Smyrna Historical and Genealogical Society,,,,,,,,"2861 Atlanta Rd, 825 Austin Drive, Smyrna, GA 30080",,,,,,Cobb County,,,Georgia,,,United States of America,,,,,,+1-,,,,,,http://http://www.smyrnahistory.org/_museum.htm,,,1985,,,"","","",,,,,,,,,,,,,,,,"",""
938,Society for the Preservation of Laurel Grove,,,,,Historical Society,,,", Savannah, GA 31412",,,,,,Chatham County,,,Georgia,,,United States of America,,,,,,+1-,,,,,,,,,1992,,,"","","",,,,,,,10315,,,,,,,,,"",""
939,Society of Georgia Archivists,,,,,Society/Association,,,", Atlanta, GA 30333",,,,,,Fulton County,,,Georgia,,,United States of America,,,,,,+1-,,,mailto:admin@soga.org,,,http://soga.org/,,,1969,,,"","","",,,,,,,133085,,,,,,,,,"",""
940,Society of the War of 1812 in the State of Georgia,,,,,Society/Association,,,"148 Weatherstone Square Drive, Woodstock, GA 30188",,,,,,Cherokee County,,,Georgia,,,United States of America,,,,,,+1-,,,,,,,,,1983,,,"","","",,,,,,,,,,,,,,,,"",""
941,Sons and Daughters of the Pilgrims,,,,,Other,,,"1604 Executive Park Ln, NE, Atlanta, GA 30329",,,,,,Fulton County,,,Georgia,,,United States of America,,,,,,+1-,,,mailto:hsdurden@bellsouth.net,,,http://nssdp.com,,,1930,,,"","","",,,,,,,,,,,,,,,,"",""
942,Sons of Confederate Veterans,,,,,Society/Association,,,", Kennesaw, GA 30144",,,,,,Cobb County,,,Georgia,,,United States of America,,,,,,+1-,,,,,,http://www.georgiascv.com/default.asp,,,1896,,,"","","",,,,,,,763,,,,,,,,,"",""
943,Sons of Confederate Veterans,,,,,,,,"500 4th St. S.E., Moultrie, GA 31776",,,,,,Colquitt County,,,Georgia,,,United States of America,,,,,,+1-,,,mailto:olereb@moultriega.net,,,http://www.georgiascv.com/,,,1896,,,"","","",,,,,,,1213,,,,,,,,,"",""
944,South Georgia Genealogical Society,,,,,Genealogical Society,,,"706 Crabapple Drive, Thomasville, GA 31757",,,,,,Thomas County,,,Georgia,,,United States of America,,,,,,+1-,,,,,,,,,1986,,,"","","",,,,,,,,,,,,,,,,"",""
945,South Georgia Regional Library System,,,,,,,,"300 Woodrow Wilson Drive, Valdosta, GA 31602",,,,,,Lowndes County,,,Georgia,,,United States of America,,,,,,+1-,,,,,,http://www.sgrl.org,,,1914,,,"","","",,,,,,,,,,,,,,,,"",""
946,Southeastern Cherokee Council,,,,,Society/Association,,,", Ochlocknee, GA 31773",,,,,,Thomas County,,,Georgia,,,United States of America,,,,,,+1-,,,,,,http://secci.com,,,1976,,,"","","",,,,,,,367,,,,,,,,,"",""
947,Southeastern Railway Museum,,,,,Museum,,,"3595 Peachtree Road, Duluth, GA 30096",,,,,,Gwinnett County,,,Georgia,,,United States of America,,,,,,+1-,,,mailto:admin@srmduluth.org,,,http://www.srmduluth.org,,,1959,,,"","","",,,,,,,1267,,,,,,,,,"",""
948,Southern Forest World,,,,,Museum,,,"1440 N. Augusta Ave., Waycross, GA 31503",,,,,,Ware County,,,Georgia,,,United States of America,,,,,,+1-,,,,,,http://southernforestworld.com/,,,1980,,,"","","",,,,,,,,,,,,,Southern-Forest-World-123493057805549/,,,"",""
949,Southern Museum Archives & Library,,,,,Museum,,,"2829 Cherokee Street, Kennesaw, GA 30144",,,,,,Cobb County,,,Georgia,,,United States of America,,,,,,+1-,,,mailto:sloy@kennesaw-ga.gov,,,http://www.southernmuseum.org/,,,,,,"","","",,,,,,,,,,,,,,,,"",""
950,Southern Polytechnic State University Library,,,,,Library,,,"1100 S. Marietta Parkway, Marietta, GA 30060",,,,,,Cobb County,,,Georgia,,,United States of America,,,,,,+1-,,,mailto:archives@spsu.edu,,,http://www.spsu.edu/library/library.html,,,1948,,,"","","",,,,,,,,,,,,,,,,"",""
951,Southwest Georgia Genealogical Society,,,,,Genealogical Society,,,", Albany, GA 31706",,,,,,Dougherty County,,,Georgia,,,United States of America,,,,,,+1-,,,mailto:Freddypage@aol.com,,,http://www.swggs.org/,,,1968,,,"","","",,,,,,,4672,,,,,,,,,"",""
952,Southwest Georgia Regional Library - Genealogy Room,,,,,,,,"301 S. Monroe Street, Bainbridge, GA 39819",,,,,,Decatur County,,,Georgia,,,United States of America,,,,,,+1-,,,mailto:swhittle@swgrl.org,,,http://www.swgrl.org/,,,1902,,,"","","",,,,,,,,,,,,,,,,"",""
953,Sparta-Hancock County Historical Society,,,,,Historical Society,,,"526 Court Street, Sparta, GA 31087",,,,,,Hancock County,,,Georgia,,,United States of America,,,,,,+1-,,,mailto:rsjoslyn@aol.com,,,http://www.shchs.org/,,,1994,,,"","","",,,,,,,,,,,,,,,,"",""
954,Spelman College Archives,,,"Archives in Atlanta, Georgia, USA",,Archives,,,"350 Spelman Lane SW, Atlanta, GA 30314",,,,,,Fulton County,,,Georgia,,,United States of America,,,,,,+1-,,,,,,http://www.spelman.edu,,,1881,,,"","","",,,,,,,115,,,,,,,,,"",""
955,Springer Opera House,,,,,"Historic Site (Parks, etc.)",,,"103 Tenth Street, Columbus, GA 31091",,,,,,Muscogee County,,,Georgia,,,United States of America,,,,,,+1-,,,,,,http://www.springeroperahouse.org,,,1871,,,"","","",,,,,,,1626,,,,,,,,,"",""
956,St. Mary's Historic Preservation Commission,,,,,Historical Society,,,"418 Osborne Street, St. Marys, GA 31558",,,,,,Camden County,,,Georgia,,,United States of America,,,,,,+1-,,,,,,,,,1978,,,"","","",,,,,,,,,,,,,,,,"",""
957,St. Marys Submarine Museum,,,,,Museum,,,"102 St. Marys Street, St. Marys, GA 31558",,,,,,Camden County,,,Georgia,,,United States of America,,,,,,+1-,,,mailto:submus@tds.net,,,http://www.stmaryssubmuseum.com,,,,,,"","","",,,,,,,,,,,,,,,,"",""
958,State Parks and Historic Sites Division,,,,,,,,"205 Butler Street SE, Suite 1352, Atlanta, GA 30334",,,,,,Fulton County,,,Georgia,,,United States of America,,,,,,+1-,,,,,,http://www.gastateparks.org/,,,1934,,,"","","",,,,,,,,,,,,,,,,"",""
959,"Steffen Thomas Museum of Art, The",,,,,Museum,,,"4200 Bethany Road, Buckhead, GA 30625",,,,,,Morgan County,,,Georgia,,,United States of America,,,,,,+1-,,,mailto:info@steffenthomas.org,,,http://www.steffenthomas.org/,,,,,,"","","",,,,,,,,,,,,,,,,"",""
960,Stephen C. Foster State Park,,,,,"Historic Site (Parks, etc.)",,,"17515 Hwy. 177, Fargo, GA 31631",,,,,,Charlton County,,,Georgia,,,United States of America,,,,,,+1-,,,mailto:stephen_foster_park@dnr.state.ga.us,,,http://www.gastateparks.org,,,1954,,,"","","",,,,,,,,,,,,,,,,"",""
961,Stephens County Historical Society,,,,,"Historical Society, Museum",,,"160 N. Alexander Street, Toccoa, GA 30577",,,,,,Stephens County,,,Georgia,,,United States of America,,,,,,+1-,,,mailto:toccoahistory@windstream.net,,,http://www.toccoahistory.com/,,,1974,,,"","","",,,,,,,,,,,,,,,,"",""
962,Stewart County Historical Commission,,,,,Historical Society,,,"Broad and Cotton Streets, Lumpkin, GA 31815",,,,,,Stewart County,,,Georgia,,,United States of America,,,,,,+1-,,,,,,http://www.bedingfieldinn.org,,,1966,,,"","","",,,,,,,818,,,,,,,,,"",""
963,"Stuart Rose Manuscript, Archives and Rare Book Library",,,,,"Library (Public, Research, Special, etc.)",,,"540 Asbury Circle, Atlanta, GA 30322",,,,,,DeKalb County,,,Georgia,,,United States of America,,,,,,+1-,,,mailto:rose.library@emory.edu,,,http://rose.library.emory.edu/index.html,,,1836,,,"","","",,,,,,,,,,,,,,,,"",""
964,Sumter Historic Trust,,,,,Historical Society,,,"318 E. Church Street, Americus, GA 31709",,,,,,Sumter County,,,Georgia,,,United States of America,,,,,,+1-,,,,,,,,,1976,,,"","","",,,,,,,1416,,,,,,,,,"",""
965,Suwanee Historical Society,,,,,Historical Society,,,", Suwanee, GA 30174",,,,,,Gwinnett County,,,Georgia,,,United States of America,,,,,,+1-,,,,,,,,,1986,,,"","","",,,,,,,815,,,,,,,,,"",""
966,Sweetwater Creek State Conservation Park,,,,,"Historic Site (Parks, etc.)",,,", Lithia Springs, GA 30122",,,,,,Douglas County,,,Georgia,,,United States of America,,,,,,+1-,,,mailto:sweetwater_creek_park@dnr.state.ga.us,,,http://gastateparks.org/info/sweetwater/,,,1971,,,"","","",,,,,,,816,,,,,,,,,"",""
967,Taliaferro County Historical Society,,,,,,,,", Crawfordville, GA 30631",,,,,,Taliaferro County,,,Georgia,,,United States of America,,,,,,+1-,,,,,,,,,1979,,,"","","",,,,,,,32,,,,,,,,,"",""
968,Tallulah Gorge State Park,,,,,"Historic Site (Parks, etc.)",,,"U.S. Highway 441, Tallulah Falls, GA 30573",,,,,,Rabun County,,,Georgia,,,United States of America,,,,,,+1-,,,,,,https://gastateparks.org/TallulahGorge,,,,,,"","","",,,,,,,248,,,,,,georgiastateparks/,,,"",""
969,Tattnall County Historic Preservation,,,,,Historical Society,,,"Brazell Street, Reidsville, GA 30453",,,,,,Tattnall County,,,Georgia,,,United States of America,,,,,,+1-,,,,,,,,,1979,,,"","","",,,,,,,392,,,,,,,,,"",""
970,Taylor County Historical-Genealogical Society,,,,,Historical Society,,,", Warner Robins, GA 31099",,,,,,Taylor County,,,Georgia,,,United States of America,,,,,,+1-,,,mailto:traceradams@cox.net,,,http://www.rootsweb.com/~gatchgs/tchgphoto2.htm,,,1995,,,"","","",,,,,,,5059,,,,,,,,,"",""
971,Taylor-Grady House,,,,,"Museum, Historic Site (Parks, etc.), Other",,,"634 Prince Street, Athens, GA 30601",,,,,,Clarke County,,,Georgia,,,United States of America,,,,,,+1-,,,mailto:jlathens@aol.com,,,http://www.taylorgradyhouse.com/,,,1839,,,"","","",,,,,,,,,,,,,,,,"",""
972,Telfair Museum of Art,,,,,,,,"Owens-Thomas House, Savannah, GA 31412",,,,,,Chatham County,,,Georgia,,,United States of America,,,,,,+1-,,,mailto:boylstonk@telfair.org,,,http://www.telfair.org/,,,1886,,,"","","",,,,,,,10081,,,,,,,,,"",""
973,Terrell County Historic Preservation Society,,,,,Historical Society,,,", Dawson, GA 39842",,,,,,Terrell County,,,Georgia,,,United States of America,,,,,,+1-,,,mailto:terrellhistorical@windstream.net,,,http://www.tchps.org/,,,1987,,,"","","",,,,,,,63,,,,,,,,,"",""
974,Terry Coleman Museum and Archives,,,,,,,,"1100 Second St., SE, Cochran, GA 31014",,,,,,Bleckley County,,,Georgia,,,United States of America,,,,,,+1-,,,mailto:jellis@mgc.edu,,,https://www.mga.edu/library/archives/coleman.php,,,,,,"","","",,,,,,,,,,,,,mgalibraries/,,,"",""
975,Thomas County Historical Society,,,,,"Historical Society, Museum",,,"725 N. Dawson Street, Thomasville, GA 31799",,,,,,Thomas County,,,Georgia,,,United States of America,,,,,,+1-,,,mailto:history@rose.net,,,http://www.thomascountyhistory.org,,,1952,,,"","","",,,,,,,1922,,,,,,,,,"",""
976,Thomas University Library Archives,,,,,,,,"1501 Millpond Road, Thomasville, GA 31792",,,,,,Thomas County,,,Georgia,,,United States of America,,,,,,+1-,,,,,,http://www.thomasu.edu,,,1950,,,"","","",,,,,,,,,,,,,,,,"",""
977,Thomaston-Upson Archives,,,,,,,,"301 S. Center Street, Thomaston, GA 30286",,,,,,Upson County,,,Georgia,,,United States of America,,,,,,+1-,,,,,,http://home.alltel.net/tuarch,,,1996,,,"","","",,,,,,,1137,,,,,,,,,"",""
978,"Thomasville Genealogical, History, and Fine Arts Library",,,,,,,,"135 North Broad Street, Thomasville, GA 31792",,,,,,Thomas County,,,Georgia,,,United States of America,,,,,,+1-,,,mailto:glibrary@rose.net,,,http://home.rose.net/~glibrary/,,,1988,,,"","","",,,,,,,1597,,,,,,,,,"",""
979,Thomasville Landmarks,,,,,Other,,,"312 N. Broad Street, Thomas, GA 31799",,,,,,Thomas County,,,Georgia,,,United States of America,,,,,,+1-,,,mailto:tli@rose.net,,,http://www.thomasvillelandmarks.org,,,1964,,,"","","",,,,,,,1285,,,,,,,,,"",""
980,Towns County Historical & Genealogical Society,,,,,,,,", Young Harris, GA 30582",,,,,,Towns County,,,Georgia,,,United States of America,,,,,,+1-,,,mailto:towns_county_ga_history@yahoo.com,,,http://www.townshistory.org/,,,1999,,,"","","",,,,,,,101,,,,,,,,,"",""
981,Traveler's Rest State Historic Site,,,,,"Museum, Historic Site (Parks, etc.)",,,"4339 Riverdale Road, Toccoa, GA 30577",,,,,,Stephens County,,,Georgia,,,United States of America,,,,,,+1-,,,mailto:travelers_rest@dnr.state.ga.us,,,http://gastateparks.org/info/travelers/,,,1955,,,"","","",,,,,,,,,,,,,,,,"",""
982,Treutlen County Historical Society,,,,,Historical Society,,,"Treutlen County Museum of Local History, Soperton, GA 30457",,,,,,Treutlen County,,,Georgia,,,United States of America,,,,,,+1-,,,,,,,,,1978,,,"","","",,,,,,,,,,,,,,,,"",""
983,Tubman African American Museum,,,,,Museum,,,"340 Walnut Street, Macon, GA 31201",,,,,,Bibb County,,,Georgia,,,United States of America,,,,,,+1-,,,mailto:guestservices@tubmanmuseum.com,,,http://www.tubmanmuseum.com,,,1981,,,"","","",,,,,,,,,,,,,,,,"",""
984,Tybee Island Historical Society,,,,,Historical Society,,,", Tybee Island, GA 31328",,,,,,Chatham County,,,Georgia,,,United States of America,,,,,,+1-,,,mailto:TybeeLH@Bellsouth.net,,,http://www.tybeelighthouse.org,,,1976,,,"","","",,,,,,,366,,,,,,,,,"",""
985,U. S. Army Forces Command,,,,,,,,"1777 Hardee Avenue S.W., Fort McPherson, GA 30330",,,,,,Fulton County,,,Georgia,,,United States of America,,,,,,+1-,,,,,,http://www.forscom.army.mil/,,,,,,"","","",,,,,,,,,,,,,,,,"",""
986,U. S. D .A. Forest Service,,,,,"Historic Site (Parks, etc.)",,,"1755 Cleveland Hwy., Gainesville, GA 30501",,,,,,Hall County,,,Georgia,,,United States of America,,,,,,+1-,,,mailto:rschneider/rs-chattoconee@Fs.Fed.us,,,http://www.fs.Fed.us/conf/,,,1936,,,"","","",,,,,,,,,,,,,,,,"",""
987,U. S. Navy Supply Corps Museum,,,,,,,,"1425 Prince Avenue, Athens, GA 30606",,,,,,Clarke County,,,Georgia,,,United States of America,,,,,,+1-,,,mailto:dan.roth@navy.mil,,,http://www.nscs.navy.mil,,,1974,,,"","","",,,,,,,,,,,,,,,,"",""
988,Union County Historical Society,,,,,,,,"Courthouse Square, Blairsville, GA 30514",,,,,,Union County,,,Georgia,,,United States of America,,,,,,+1-,,,,,,http://www.unioncountyhistory.org,,,1976,,,"","","",,,,,,,35,,,,,,,,,"",""
989,United Daughters of the Confederacy,,,,,Other,,,"1604 Executive Park Lane NE, Atlanta, GA 30329",,,,,,DeKalb County,,,Georgia,,,United States of America,,,,,,+1-,,,mailto:majelvis@bellsouth.net,,,http://www.gaudc.org,,,1895,,,"","","",,,,,,,,,,,,,,,,"",""
990,United States Daughters of 1812,,,,,Society/Association,,,", Kingston, GA 30145",,,,,,Bartow County,,,Georgia,,,United States of America,,,,,,+1-,,,mailto:diannebc@bellsouth.net,,,http://www.rootsweb.ancestry.com/~gausd1812/index.html,,,1901,,,"","","",,,,,,,160,,,,,,,,,"",""
991,University of Georgia,,,,,,,,"Law Library, Athens, GA 30605",,,,,,Clarke County,,,Georgia,,,United States of America,,,,,,+1-,,,mailto:lawref@uga.edu,,,http://www.law.uga.edu/library/index.html,,,,,,"","","",,,,,,,,,,,,,,,,"",""
992,University of Georgia Libraries,,,,,,,,"University of Georgia, Athens, GA 30602",,,,,,Clarke County,,,Georgia,,,United States of America,,,,,,+1-,,,,,,http://www.libs.uga.edu/hargrett/speccoll.html,,,,,,"","","",,,,,,,,,,,,,,,,"",""
993,"University of Georgia Marine Extension Service, The",,,,,"Museum, Other",,,"30 Ocean Science Circle, Savannah, GA 31411",,,,,,Chatham County,,,Georgia,,,United States of America,,,,,,+1-,,,mailto:bobwms@uga.edu,,,http://www.marex.uga.edu/aquarium/,,,,,,"","","",,,,,,,,,,,,,,,,"",""
994,University of Georgia Media Archives and Peabody Awards Collection,,,,,,,,"University of Georgia Libraries, Athens, GA 30602",,,,,,Clarke County,,,Georgia,,,United States of America,,,,,,+1-,,,mailto:abolins@uga.edu,,,http://www.libs.uga.edu/media/index.html,,,,,,"","","",,,,,,,,,,,,,,,,"",""
995,University of West Georgia,,,,,Library,,,"1601 Maple St., Carrollton, GA 30118",,,,,,Carroll County,,,Georgia,,,United States of America,,,,,,+1-,,,mailto:sdurham@westga.edu,,,http://www.westga.edu/~library/,,,1981,,,"","","",,,,,,,,,,,,,,,,"",""
996,Upson Historical Society,,,,,Historical Society,,,", Thomaston, GA 30286",,,,,,Upson County,,,Georgia,,,United States of America,,,,,,+1-,,,,,,http://rootsweb.com/~gauhs,,,1967,,,"","","",,,,,,,363,,,,,,,,,"",""
997,Valdosta Heritage Foundation,,,,,Historical Society,,,", Valdosta, GA 31603",,,,,,Lowndes County,,,Georgia,,,United States of America,,,,,,+1-,,,,,,,,,1979,,,"","","",,,,,,,1792,,,,,,,,,"",""
998,Valdosta State University Archives,,,,,Archives,,,"Odum Library, Valdosta State University, Valdosta, GA 31698",,,,,,Lowndes County,,,Georgia,,,United States of America,,,,,,+1-,,,mailto:dsdavis@valdosta.edu,,,http://www.valdosta.edu/library/find/arch/index.shtml,,,,,,"","","",,,,,,,,,,,,,,,,"",""
999,Vernacular Georgia,,,,,Society/Association,,,"Department of Architectural History, SCAD, Savannah, GA 31402",,,,,,Chatham County,,,Georgia,,,United States of America,,,,,,+1-,,,mailto:erossell@scad.edu,,,,,,1994,,,"","","",,,,,,,3146,,,,,,,,,"",""
1000,Victorian Society of Savannah,,,,,Society/Association,,,"101 East 45th Street, Savannah, GA 31405",,,,,,Chatham County,,,Georgia,,,United States of America,,,,,,+1-,,,,,,,,,1964,,,"","","",,,,,,,,,,,,,,,,"",""
1001,Vienna Historic Preservation Society,,,,,Historical Society,,,", Vienna, GA 31092",,,,,,Dooly County,,,Georgia,,,United States of America,,,,,,+1-,,,mailto:jjoiner@sowega.net,,,http://www.historicvienna.org,,,1983,,,"","","",,,,,,,309,,,,,,,,,"",""
1002,W. W. Branch Library,,,,,"Library (Public, Research, Special, etc.)",,,"909 East Bolton Street, Savannah, GA 31401",,,,,,Chatham County,,,Georgia,,,United States of America,,,,,,+1-,,,mailto:tugglej@liveoakpl.org,,,http://www.liveoakpl.org,,,,,,"","","",,,,,,,,,,,,,,,,"",""
1003,Walker County Historical Society,,,,,Historical Society,,,"305 S. Duke Street, Lafayette, GA 30728",,,,,,Walker County,,,Georgia,,,United States of America,,,,,,+1-,,,mailto:jtrubey@chrl.org,,,,,,1976,,,"","","",,,,,,,707,,,,,,,,,"",""
1004,Washington Historical Museum,,,,,Museum,,,"308 E. Robert Toombs Avenue, Washington, GA 30673",,,,,,Wilkes County,,,Georgia,,,United States of America,,,,,,+1-,,,mailto:historical@washingtonwilkes.org,,,http://www.historyofwilkes.org/sites-historicalmuseum.html,,,1960,,,"","","",,,,,,,,,,,,,,,,"",""
1005,Washington-Wilkes Historical Foundation,,,,,Historical Society,,,", Washington, GA 30673",,,,,,Wilkes County,,,Georgia,,,United States of America,,,,,,+1-,,,mailto:historicalww@gmail.com,,,http://www.historyofwilkes.org,,,1968,,,"","","",,,,,,,337,,,,,,,,,"",""
1006,Watson-Brown Foundation,,,,,"Museum, Historic Site (Parks, etc.)",,,"502 Hickory Hill Drive, Thomson, GA 30824",,,,,,McDuffie County,,,Georgia,,,United States of America,,,,,,+1-,,,mailto:mzupan@hickory-hill.org,,,http://www.hickory-hill.org,,,,,,"","","",,,,,,,,,,,,,,,,"",""
1007,Wayne County Historical Society,,,,,Historical Society,,,"125 Northeast Broad Street, Jesup, GA 31545",,,,,,Wayne County,,,Georgia,,,United States of America,,,,,,+1-,,,,,,,,,1986,,,"","","",,,,,,,,,,,,,,,,"",""
1008,West Broad YMCA Branch,,,,,,,,"1110 May St., Savannah, GA 31415",,,,,,Chatham County,,,Georgia,,,United States of America,,,,,,+1-,,,mailto:tugglej@liveoakpl.org,,,http://www.liveoakpl.org,,,,,,"","","",,,,,,,,,,,,,,,,"",""
1009,West Chatham Branch Library,,,,,"Library (Public, Research, Special, etc.)",,,"216 South Rogers Street, Pooler, GA 31322",,,,,,Chatham County,,,Georgia,,,United States of America,,,,,,+1-,,,mailto:tugglej@liveoakpl.org,,,http://www.liveoakpl.org,,,,,,"","","",,,,,,,,,,,,,,,,"",""
1010,West Georgia Museum of Tallapoosa,,,,,Museum,,,"21 West Lyon Street, Tallapoosa, GA 30176",,,,,,Haralson County,,,Georgia,,,United States of America,,,,,,+1-,,,mailto:wgmuseum@bellsouth.net,,,http://www.tallapoosaga.gov/museum/,,,1990,,,"","","",,,,,,,725,,,,,,,,,"",""
1011,West Georgia Regional Library,,,,,,,,"710 Rome Street, Carrollton, GA 30117",,,,,,Carroll County,,,Georgia,,,United States of America,,,,,,+1-,,,mailto:roni@wgrl.net,,,http://www.wgrl.net,,,1944,,,"","","",,,,,,,,,,,,,,,,"",""
1012,Weston's Woman's Club,,,,,Society/Association,,,", Weston, GA 31832",,,,,,Webster County,,,Georgia,,,United States of America,,,,,,+1-,,,,,,,,,1946,,,"","","",,,,,,,127,,,,,,,,,"",""
1013,White County Historical Society,,,,,Society/Association,,,"Courthouse Square, Cleveland, GA 30528",,,,,,White County,,,Georgia,,,United States of America,,,,,,+1-,,,,,,,,,1965,,,"","","",,,,,,,1139,,,,,,,,,"",""
1014,Willet Memorial Library,,,,,,,,"4760 Forsyth Road, Macon, GA 31210",,,,,,Bibb County,,,Georgia,,,United States of America,,,,,,+1-,,,mailto:smcneil@wesleyancollege.edu,,,https://www.wesleyancollege.edu/library/willetlibrary-Home.cfm,,,1836,,,"","","",,,,,,,,,,,,,,,,"",""
1015,William Breman Jewish Heritage Museum,,,,,Society/Association,,,"1440 Spring Street, Atlanta, GA 30309",,,,,,Fulton County,,,Georgia,,,United States of America,,,,,,+1-,,,mailto:sberman@thebreman.org,,,http://www.thebreman.org,,,1985,,,"","","",,,,,,,,,,,,,,,,"",""
